{
  "schemaVersion": 6,
  "catalog": {
    "slug": "fixture",
    "name": "Fixture Catalog",
    "description": "Portable golden fixture",
    "defaultLanguage": "nl-NL",
    "keywords": ["documents", "government"],
    "presentation": null
  },
  "publisher": {
    "name": "Epistola"
  },
  "release": {
    "version": "1.0.0"
  },
  "resources": [
    {
      "type": "theme",
      "slug": "default",
      "name": "Default",
      "detailUrl": "./resources/theme/default.json"
    }
  ],
  "dependencies": []
}
